[
  {
    "id": "wd-green-sn3000-1tb-md-20260928",
    "name": "WD Green SN3000 1TB NVMe Gen4 SSD",
    "category": "SSD",
    "price": 14660,
    "reference": 20000,
    "score": 8.8,
    "seller": "MD Computers",
    "url": "https://www.mdcomputers.in/product/wd-green-sn3000-1tb-nvme-ssd-wds100t5g0e",
    "checked_at": "2026-09-28T06:25:00Z",
    "condition": "New",
    "stock": "In Stock",
    "warranty": "3 Years",
    "verification": {
      "price": true,
      "seller": true,
      "availability": true,
      "terms": true,
      "reference_price": true
    },
    "icon": "💾"
  },
  {
    "id": "gigabyte-rx7600-gaming-oc-8gb-md-20260928",
    "name": "Gigabyte Radeon RX 7600 Gaming OC 8GB GDDR6",
    "category": "GPU",
    "price": 40999,
    "reference": 91350,
    "score": 8,
    "seller": "MD Computers",
    "url": "https://mdcomputers.in/product/gigabyte-gaming-graphics-card-gv-r76gaming-oc-8gd",
    "checked_at": "2026-09-28T06:28:00Z",
    "condition": "New",
    "stock": "In Stock",
    "warranty": "3 Years",
    "verification": {
      "price": true,
      "seller": true,
      "availability": true,
      "terms": true,
      "reference_price": true
    },
    "icon": "🎮"
  },
  {
    "id": "zotac-rtx-3050-6gb-md-20260928",
    "name": "ZOTAC Gaming GeForce RTX 3050 Twin Edge OC 6GB GDDR6",
    "category": "GPU",
    "price": 30590,
    "reference": 52800,
    "score": 8.2,
    "seller": "MD Computers",
    "url": "https://www.mdcomputers.in/product/zotac-rtx3050-twin-edge-oc-graphics-card-zt-a30510h-10l",
    "checked_at": "2026-09-28T06:31:00Z",
    "condition": "New",
    "stock": "In Stock",
    "warranty": "3 Years",
    "verification": {
      "price": true,
      "seller": true,
      "availability": true,
      "terms": true,
      "reference_price": true
    },
    "icon": "🎮"
  },
  {
    "id": "amd-ryzen-5-5500-md-20260928",
    "name": "AMD Ryzen 5 5500 Processor",
    "category": "CPU",
    "price": 9450,
    "reference": 19000,
    "score": 9,
    "seller": "MD Computers",
    "url": "https://mdcomputers.in/product/amd-ryzen-5-5500-100-100000457box-desktop-processor",
    "checked_at": "2026-09-28T06:34:00Z",
    "condition": "New",
    "stock": "In Stock",
    "warranty": "3 Years",
    "verification": {
      "price": true,
      "seller": true,
      "availability": true,
      "terms": true,
      "reference_price": true
    },
    "icon": "🧠"
  }
]
